{
  "schema": "trazada.events",
  "schemaVersion": "1.2.0",
  "raceControl": [
    {
      "t": 1000,
      "lap": 4,
      "category": "Other",
      "flag": null,
      "scope": null,
      "sector": null,
      "car": null,
      "text": "CAR 18 (STR) LAP DELETED - TRACK LIMITS AT TURN 13 LAP 1 14:15:19",
      "parsed": { "kind": "track_limits_lap_deleted", "cars": ["18"], "turn": 13, "lap": 1, "outcome": null, "detail": null, "s": null, "marshalSector": null }
    }
  ],
  "sectorFlags": [{ "sector": 21, "flag": "YELLOW", "fromMs": 500, "toMs": 900 }],
  "windows": [{ "kind": "sc", "fromMs": 600, "toMs": 800 }],
  "weather": {
    "t": [400, 60400, 120400],
    "airC": [23.6, 23.7, null],
    "trackC": [41.2, 41.1, 40.8],
    "humidity": [45.0, 45.4, 46.1],
    "pressureHpa": [966.7, 966.5, null],
    "rain": [false, true, null],
    "windMs": [1.5, 2.2, null],
    "windDeg": [330, 317, null]
  },
  "radio": [
    { "t": 1200, "car": "18", "file": "radio/0123456789abcdef.mp3", "bytes": 48213 },
    { "t": 5400, "car": "44", "file": "radio/fedcba9876543210.mp3", "bytes": 61022 }
  ]
}
